### ISSUE TITLE
BBC iPlayer 2.4.18 has stopped working - Please let me know what other info you need. 

### ISSUE THREAD

**Issue by GoogleCodeExporter** [joolswills/plugin.video.iplayer#116]
```
What steps will reproduce the problem?
1.Select BBC iPlayer from XBMC main menu
2.Channel list appears.
3.Program list appears - thumbnails load
4.Select program

Tried rolling back the previous 3 versions. Been running iplayer for 6? months 
without issue.
Channel 4, ITV and five work fine.

What is the expected output? What do you see instead?
I expect the program to start. Instead I get
Playback failed - One or more items failed to play. Check the log file for 
details.

Debug log output (http://pastebin.com/)
http://pastebin.com/KvsSmKMh


What version of the plugin are you using? On what OS?
2.4.18
Linux raspbmc 3.6.11 #2 PREEMPT Wed Mar 13 17:12:47 UTC 2013 armv6l GNU/Linux

pi@raspbmc:/$ cat /proc/version 
Linux version 3.6.11 (root@buildraspbmc) (gcc version 4.7.1 20120402 
(prerelease) (crosstool-NG 1.15.2) ) #2 PREEMPT Wed Mar 13 17:12:47 UTC 2013


Please provide any additional information below.

I connect through a vpn

eth0      Link encap:Ethernet  HWaddr b8:27:eb:d5:43:d4  
          inet addr:192.168.0.3  Bcast:192.168.0.255  Mask:255.255.255.0
          inet6 addr: fe80::ba27:ebff:fed5:43d4/64 Scope:Link
          UP BROADCAST RUNNING MULTICAST  MTU:1500  Metric:1
          RX packets:3151 errors:0 dropped:0 overruns:0 frame:0
          TX packets:2141 errors:0 dropped:0 overruns:0 carrier:0
          collisions:0 txqueuelen:1000 
          RX bytes:1216918 (1.1 MiB)  TX bytes:400981 (391.5 KiB)

lo        Link encap:Local Loopback  
          inet addr:127.0.0.1  Mask:255.0.0.0
          inet6 addr: ::1/128 Scope:Host
          UP LOOPBACK RUNNING  MTU:16436  Metric:1
          RX packets:3 errors:0 dropped:0 overruns:0 frame:0
          TX packets:3 errors:0 dropped:0 overruns:0 carrier:0
          collisions:0 txqueuelen:0 
          RX bytes:217 (217.0 B)  TX bytes:217 (217.0 B)

tun0      Link encap:UNSPEC  HWaddr 
00-00-00-00-00-00-00-00-00-00-00-00-00-00-00-00  
          inet addr:10.xxx.5.90  P-t-P:10.xxx.5.90  Mask:255.255.252.0
          UP POINTOPOINT RUNNING NOARP MULTICAST  MTU:1500  Metric:1
          RX packets:676 errors:0 dropped:0 overruns:0 frame:0
          TX packets:567 errors:0 dropped:0 overruns:0 carrier:0
          collisions:0 txqueuelen:100 
          RX bytes:561720 (548.5 KiB)  TX bytes:44200 (43.1 KiB)


The vpn shows to be in the UK- http://iplocation.truevue.org/87.117.238.0.html
Tried different vpn scripts all fail -- so not linked to ip?

pi@raspbmc:/$ traceroute google.co.uk
traceroute to google.co.uk (74.125.225.223), 30 hops max, 60 byte packets
 1  * * *
 2  87.117.238.65 (87.117.238.65)  176.551 ms  176.581 ms  175.638 ms
 3  87.117.212.37 (87.117.212.37)  173.323 ms  172.650 ms  172.310 ms
 4  610.core1.hex.as20860.net (62.233.127.181)  171.873 ms  167.509 ms  166.845 ms
 5  202.core1.thn.as20860.net (62.233.127.11)  180.328 ms  180.962 ms  181.537 ms
 6  google.core1.thn.as20860.net (62.233.127.194)  166.336 ms  182.384 ms  182.368 ms
 7  209.85.240.61 (209.85.240.61)  179.907 ms 209.85.240.63 (209.85.240.63)  180.668 ms 209.85.240.61 (209.85.240.61)  180.790 ms
 8  209.85.253.94 (209.85.253.94)  180.890 ms  180.983 ms  180.926 ms
 9  72.14.235.91 (72.14.235.91)  245.901 ms 72.14.235.89 (72.14.235.89)  249.347 ms  239.004 ms
^C


Lots of space 

pi@raspbmc:/$ df -hl /
Filesystem      Size  Used Avail Use% Mounted on
/dev/mmcblk0p2  7.3G  1.1G  5.9G  16% /

Lots of memory

pi@raspbmc:/$ free
             total       used       free     shared    buffers     cached
Mem:        384468      90984     293484          0       1608      30036
-/+ buffers/cache:      59340     325128
Swap:            0          0          0

reasonable processor ? 

pi@raspbmc:/$ top 

top - 22:52:19 up 18 min,  1 user,  load average: 0.65, 0.50, 0.43
Tasks:  71 total,   1 running,  70 sleeping,   0 stopped,   0 zombie
%Cpu(s): 25.6 us,  9.2 sy,  3.1 ni, 62.1 id,  0.0 wa,  0.0 hi,  0.0 si,  0.0 st
KiB Mem:    384468 total,    91604 used,   292864 free,     1620 buffers
KiB Swap:        0 total,        0 used,        0 free,    30336 cached

  PID USER      PR  NI  VIRT  RES  SHR S  %CPU %MEM    TIME+  COMMAND                                                                                    
  651 pi        20   0  286m  42m  18m S  36.8 11.4   7:14.95 xbmc.bin                                                                                   
   27 root       1 -19     0    0    0 S   1.0  0.0   0:08.06 VCHIQ-0                                                                                    
 1295 pi        20   0  3088 1236  912 R   1.0  0.3   0:00.26 top                                                                                        
 1259 root      20   0  2864 1120  880 S   0.3  0.3   0:01.05 dropbear                                                                                   
 1293 root      20   0     0    0    0 S   0.3  0.0   0:00.03 kworker/0:0                                                                                
    1 root      20   0  3124 1732 1236 S   0.0  0.5   0:01.29 init       


When I try an play a program
pi@raspbmc:/$ sudo tcpdump not port 22
tcpdump: verbose output suppressed, use -v or -vv for full protocol decode
listening on eth0, link-type EN10MB (Ethernet), capture size 65535 bytes
22:55:51.435559 IP Switch-Cupboard.local.43451 > raspbmc.local.http: Flags 
[P.], seq 3187080386:3187080941, ack 1931576079, win 8192, options [nop,nop,TS 
val 885858706 ecr 102848], length 555
22:55:51.439903 IP raspbmc.local.42787 > 192.168.0.1.domain: 53608+ PTR? 
7.0.168.192.in-addr.arpa. (42)
22:55:51.443871 IP raspbmc.local.http > Switch-Cupboard.local.43451: Flags 
[P.], seq 1:145, ack 555, win 661, options [nop,nop,TS val 102950 ecr 
885858706], length 144
22:55:51.445578 IP Switch-Cupboard.local.43451 > raspbmc.local.http: Flags [.], 
ack 145, win 8183, options [nop,nop,TS val 885858719 ecr 102950], length 0
22:55:51.462286 IP 192.168.0.1.domain > raspbmc.local.42787: 53608 NXDomain* 
0/1/0 (114)
22:55:51.565159 IP6 fe80::ba27:ebff:fed5:43d4.mdns > ff02::fb.mdns: 0 PTR (QM)? 
7.0.168.192.in-addr.arpa. (42)
22:55:51.565770 IP raspbmc.local.mdns > 224.0.0.251.mdns: 0 PTR (QM)? 
7.0.168.192.in-addr.arpa. (42)
22:55:51.566562 IP Switch-Cupboard.local.mdns > 224.0.0.251.mdns: 0*- [0q] 
1/0/1 (Cache flush) PTR Switch-Cupboard.local. (89)
22:55:51.566835 IP6 fe80::21f:f3ff:fe41:d2be.mdns > ff02::fb.mdns: 0*- [0q] 
1/0/1 (Cache flush) PTR Switch-Cupboard.local. (89)
22:55:51.568528 IP raspbmc.local.58668 > 192.168.0.1.domain: 26085+ PTR? 
3.0.168.192.in-addr.arpa. (42)
22:55:51.591277 IP 192.168.0.1.domain > raspbmc.local.58668: 26085 NXDomain* 
0/1/0 (114)
22:55:51.595670 IP raspbmc.local.54536 > 192.168.0.1.domain: 10664+ PTR? 
1.0.168.192.in-addr.arpa. (42)
22:55:51.618131 IP 192.168.0.1.domain > raspbmc.local.54536: 10664 NXDomain* 
0/1/0 (114)
22:55:51.642017 IP raspbmc.local.39305 > 87.117.238.66.domain: 12521 Refused|$ 
[58139q][|domain]
22:55:51.720479 IP6 fe80::ba27:ebff:fed5:43d4.mdns > ff02::fb.mdns: 0 PTR (QM)? 
1.0.168.192.in-addr.arpa. (42)
22:55:51.721099 IP raspbmc.local.mdns > 224.0.0.251.mdns: 0 PTR (QM)? 
1.0.168.192.in-addr.arpa. (42)
22:55:52.193685 IP 87.117.238.66.domain > raspbmc.local.39305: 12452 update 
YXDomain*-| [29604q][|domain]
22:55:52.453032 IP Switch-Cupboard.local.43451 > raspbmc.local.http: Flags 
[P.], seq 555:1110, ack 145, win 8192, options [nop,nop,TS val 885859718 ecr 
102950], length 555
22:55:52.454494 IP raspbmc.local.http > Switch-Cupboard.local.43451: Flags 
[P.], seq 145:289, ack 1110, win 661, options [nop,nop,TS val 103051 ecr 
885859718], length 144
22:55:52.459635 IP Switch-Cupboard.local.43451 > raspbmc.local.http: Flags [.], 
ack 289, win 8183, options [nop,nop,TS val 885859724 ecr 103051], length 0
22:55:52.505587 STP 802.1d, Config, Flags [none], bridge-id 
800c.00:0c:30:1b:79:80.8011, length 43
22:55:52.720947 IP6 fe80::ba27:ebff:fed5:43d4.mdns > ff02::fb.mdns: 0 PTR (QM)? 
1.0.168.192.in-addr.arpa. (42)
22:55:52.721568 IP raspbmc.local.mdns > 224.0.0.251.mdns: 0 PTR (QM)? 
1.0.168.192.in-addr.arpa. (42)
22:55:53.465553 IP Switch-Cupboard.local.43451 > raspbmc.local.http: Flags 
[P.], seq 1110:1665, ack 289, win 8192, options [nop,nop,TS val 885860726 ecr 
103051], length 555
22:55:53.467167 IP raspbmc.local.http > Switch-Cupboard.local.43451: Flags 
[P.], seq 289:433, ack 1665, win 661, options [nop,nop,TS val 103152 ecr 
885860726], length 144
22:55:53.468880 IP Switch-Cupboard.local.43451 > raspbmc.local.http: Flags [.], 
ack 433, win 8183, options [nop,nop,TS val 885860731 ecr 103152], length 0
22:55:54.475593 IP Switch-Cupboard.local.43451 > raspbmc.local.http: Flags 
[P.], seq 1665:2220, ack 433, win 8192, options [nop,nop,TS val 885861734 ecr 
103152], length 555
22:55:54.491194 IP raspbmc.local.http > Switch-Cupboard.local.43451: Flags 
[P.], seq 433:577, ack 2220, win 661, options [nop,nop,TS val 103255 ecr 
885861734], length 144
22:55:54.493024 IP Switch-Cupboard.local.43451 > raspbmc.local.http: Flags [.], 
ack 577, win 8183, options [nop,nop,TS val 885861753 ecr 103255], length 0
22:55:54.505600 STP 802.1d, Config, Flags [none], bridge-id 
800c.00:0c:30:1b:79:80.8011, length 43
22:55:54.723427 IP6 fe80::ba27:ebff:fed5:43d4.mdns > ff02::fb.mdns: 0 PTR (QM)? 
1.0.168.192.in-addr.arpa. (42)
22:55:54.724034 IP raspbmc.local.mdns > 224.0.0.251.mdns: 0 PTR (QM)? 
1.0.168.192.in-addr.arpa. (42)
22:55:56.622606 IP raspbmc.local.49463 > 192.168.0.1.domain: 7243+ PTR? 
4.d.3.4.5.d.e.f.f.f.b.e.7.2.a.b.0.0.0.0.0.0.0.0.0.0.0.0.0.8.e.f.ip6.arpa. (90)
22:55:56.643549 IP 87.117.238.66.domain > raspbmc.local.39305: 12338 updateDA 
YXRRSet-| [56144q][|domain]
22:55:56.643930 IP 87.117.238.66.domain > raspbmc.local.39305: 12354 inv_q 
NXRRSet-|$ [4744q][|domain]
22:55:56.645187 IP raspbmc.local.39305 > 87.117.238.66.domain: 12387 op7 
Resp13|$ [39321q][|domain]
22:55:56.674012 IP raspbmc.local.40210 > 192.168.0.1.domain: 27423+ PTR? 
251.0.0.224.in-addr.arpa. (42)
22:56:01.701706 IP raspbmc.local.50837 > 192.168.0.1.domain: 25458+ PTR? 
e.b.2.d.1.4.e.f.f.f.3.f.f.1.2.0.0.0.0.0.0.0.0.0.0.0.0.0.0.8.e.f.ip6.arpa. (90)
22:56:01.725121 IP 192.168.0.1.domain > raspbmc.local.50837: 25458 NXDomain* 
0/1/0 (125)
22:56:01.726823 IP raspbmc.local.41158 > 192.168.0.1.domain: 32105+ PTR? 
66.238.117.87.in-addr.arpa. (44)
22:56:01.750760 IP 192.168.0.1.domain > raspbmc.local.41158: 32105 NXDomain 
0/1/0 (110)
22:56:01.852681 IP6 fe80::ba27:ebff:fed5:43d4.mdns > ff02::fb.mdns: 0 PTR (QM)? 
66.238.117.87.in-addr.arpa. (44)
22:56:01.853290 IP raspbmc.local.mdns > 224.0.0.251.mdns: 0 PTR (QM)? 
66.238.117.87.in-addr.arpa. (44)
22:56:02.505699 STP 802.1d, Config, Flags [none], bridge-id 
800c.00:0c:30:1b:79:80.8011, length 43
22:56:06.920575 IP raspbmc.local > igmp.mcast.net: igmp v3 report, 1 group 
record(s)
22:56:06.921550 IP raspbmc.local.55819 > 192.168.0.1.domain: 12882+ PTR? 
22.0.0.224.in-addr.arpa. (41)
22:56:06.944126 IP 192.168.0.1.domain > raspbmc.local.55819: 12882 1/0/0 PTR 
igmp.mcast.net. (69)
22:56:07.690782 IP Switch-Cupboard.local.43451 > raspbmc.local.http: Flags 
[P.], seq 8880:9435, ack 2305, win 8192, options [nop,nop,TS val 885874887 ecr 
104474], length 555
22:56:07.697877 IP raspbmc.local.http > Switch-Cupboard.local.43451: Flags 
[P.], seq 2305:2449, ack 9435, win 661, options [nop,nop,TS val 104575 ecr 
885874887], length 144
22:56:07.699722 IP Switch-Cupboard.local.43451 > raspbmc.local.http: Flags [.], 
ack 2449, win 8183, options [nop,nop,TS val 885874895 ecr 104575], length 0
22:56:08.505753 STP 802.1d, Config, Flags [none], bridge-id 
800c.00:0c:30:1b:79:80.8011, length 43
22:56:08.705342 IP Switch-Cupboard.local.43451 > raspbmc.local.http: Flags 
[P.], seq 9435:9990, ack 2449, win 8192, options [nop,nop,TS val 885875893 ecr 
104575], length 555
22:56:08.708276 IP raspbmc.local.http > Switch-Cupboard.local.43451: Flags 
[P.], seq 2449:2593, ack 9990, win 661, options [nop,nop,TS val 104676 ecr 
885875893], length 144
22:56:08.711179 IP Switch-Cupboard.local.43451 > raspbmc.local.http: Flags [.], 
ack 2593, win 8183, options [nop,nop,TS val 885875899 ecr 104676], length 0
22:56:09.091965 IP raspbmc.local.39305 > 87.117.238.66.domain: 12317 NotAuth| 
[41294q][|domain]
22:56:09.718135 IP Switch-Cupboard.local.43451 > raspbmc.local.http: Flags 
[P.], seq 9990:10545, ack 2593, win 8192, options [nop,nop,TS val 885876893 ecr 
104676], length 555
22:56:09.721117 IP raspbmc.local.http > Switch-Cupboard.local.43451: Flags 
[P.], seq 2593:2737, ack 10545, win 661, options [nop,nop,TS val 104778 ecr 
885876893], length 144
22:56:09.722795 IP Switch-Cupboard.local.43451 > raspbmc.local.http: Flags [.], 
ack 2737, win 8183, options [nop,nop,TS val 885876899 ecr 104778], length 0
22:56:10.505771 STP 802.1d, Config, Flags [none], bridge-id 
800c.00:0c:30:1b:79:80.8011, length 43
22:56:10.729729 IP Switch-Cupboard.local.43451 > raspbmc.local.http: Flags 
[P.], seq 10545:11100, ack 2737, win 8192, options [nop,nop,TS val 885877897 
ecr 104778], length 555
22:56:10.732672 IP raspbmc.local.http > Switch-Cupboard.local.43451: Flags 
[P.], seq 2737:2881, ack 11100, win 661, options [nop,nop,TS val 104879 ecr 
885877897], length 144
22:56:10.735915 IP Switch-Cupboard.local.43451 > raspbmc.local.http: Flags [.], 
ack 2881, win 8183, options [nop,nop,TS val 885877902 ecr 104879], length 0
^C
62 packets captured
168 packets received by filter
106 packets dropped by kernel


```

Original issue reported on code.google.com by `and...@phoe.be` on 15 Jun 2013 at 4:58
